{
  "version": 1,
  "instrument": "ledger-retention",
  "seed": 73,
  "rounds": 48,
  "bars": {
    "referencedResolution": 1,
    "resumedCorrectness": 1,
    "retrievalRecall10": 1
  },
  "decision": {
    "archive": "unreferenced",
    "goal": "lossless-dictionary",
    "rationale": "Refuse an impossible budget; preserve admitted references and exact progress evidence."
  },
  "quota": {
    "universalBytes": null,
    "note": "Quota depends on host, origin usage and browser mode; failures must be observed."
  },
  "rows": [
    {
      "policy": "none",
      "maxItems": 48,
      "footprint": {
        "bytes": 58454,
        "overhead": 2,
        "classes": {
          "counters": {
            "bytes": 44,
            "items": 2
          },
          "goals": {
            "bytes": 16443,
            "items": 1
          },
          "memories": {
            "bytes": 4899,
            "items": 6
          },
          "skills": {
            "bytes": 746,
            "items": 1
          },
          "archives": {
            "bytes": 36320,
            "items": 96
          }
        }
      },
      "evicted": [],
      "addressResolution": 1,
      "referencedResolution": 1,
      "unreferencedResolution": 1,
      "resumedCorrectness": 1,
      "retrievalRecall10": 1,
      "failedWrites": 0,
      "goalChars": 14841
    },
    {
      "policy": "oldest",
      "maxItems": 48,
      "footprint": {
        "bytes": 58454,
        "overhead": 2,
        "classes": {
          "counters": {
            "bytes": 44,
            "items": 2
          },
          "goals": {
            "bytes": 16443,
            "items": 1
          },
          "memories": {
            "bytes": 4899,
            "items": 6
          },
          "skills": {
            "bytes": 746,
            "items": 1
          },
          "archives": {
            "bytes": 36320,
            "items": 96
          }
        }
      },
      "evicted": [],
      "addressResolution": 1,
      "referencedResolution": 1,
      "unreferencedResolution": 1,
      "resumedCorrectness": 1,
      "retrievalRecall10": 1,
      "failedWrites": 0,
      "goalChars": 14841
    },
    {
      "policy": "unreferenced",
      "maxItems": 48,
      "footprint": {
        "bytes": 58454,
        "overhead": 2,
        "classes": {
          "counters": {
            "bytes": 44,
            "items": 2
          },
          "goals": {
            "bytes": 16443,
            "items": 1
          },
          "memories": {
            "bytes": 4899,
            "items": 6
          },
          "skills": {
            "bytes": 746,
            "items": 1
          },
          "archives": {
            "bytes": 36320,
            "items": 96
          }
        }
      },
      "evicted": [],
      "addressResolution": 1,
      "referencedResolution": 1,
      "unreferencedResolution": 1,
      "resumedCorrectness": 1,
      "retrievalRecall10": 1,
      "failedWrites": 0,
      "goalChars": 14841
    },
    {
      "policy": "checkpoint",
      "maxItems": 48,
      "footprint": {
        "bytes": 46238,
        "overhead": 2,
        "classes": {
          "counters": {
            "bytes": 44,
            "items": 2
          },
          "goals": {
            "bytes": 4227,
            "items": 1
          },
          "memories": {
            "bytes": 4899,
            "items": 6
          },
          "skills": {
            "bytes": 746,
            "items": 1
          },
          "archives": {
            "bytes": 36320,
            "items": 96
          }
        }
      },
      "evicted": [],
      "addressResolution": 1,
      "referencedResolution": 1,
      "unreferencedResolution": 1,
      "resumedCorrectness": 1,
      "retrievalRecall10": 1,
      "failedWrites": 0,
      "goalChars": 4216
    },
    {
      "policy": "none",
      "maxItems": 24,
      "footprint": {
        "bytes": 58454,
        "overhead": 2,
        "classes": {
          "counters": {
            "bytes": 44,
            "items": 2
          },
          "goals": {
            "bytes": 16443,
            "items": 1
          },
          "memories": {
            "bytes": 4899,
            "items": 6
          },
          "skills": {
            "bytes": 746,
            "items": 1
          },
          "archives": {
            "bytes": 36320,
            "items": 96
          }
        }
      },
      "evicted": [],
      "addressResolution": 1,
      "referencedResolution": 1,
      "unreferencedResolution": 1,
      "resumedCorrectness": 1,
      "retrievalRecall10": 1,
      "failedWrites": 1,
      "goalChars": 14841
    },
    {
      "policy": "oldest",
      "maxItems": 24,
      "footprint": {
        "bytes": 40292,
        "overhead": 2,
        "classes": {
          "counters": {
            "bytes": 44,
            "items": 2
          },
          "goals": {
            "bytes": 16443,
            "items": 1
          },
          "memories": {
            "bytes": 4899,
            "items": 6
          },
          "skills": {
            "bytes": 746,
            "items": 1
          },
          "archives": {
            "bytes": 18158,
            "items": 48
          }
        }
      },
      "evicted": [
        "round-0000",
        "round-0001",
        "round-0002",
        "round-0003",
        "round-0004",
        "round-0005",
        "round-0006",
        "round-0007",
        "round-0008",
        "round-0009",
        "round-0010",
        "round-0011",
        "round-0012",
        "round-0013",
        "round-0014",
        "round-0015",
        "round-0016",
        "round-0017",
        "round-0018",
        "round-0019",
        "round-0020",
        "round-0021",
        "round-0022",
        "round-0023"
      ],
      "addressResolution": 0.5,
      "referencedResolution": 0.5,
      "unreferencedResolution": 0.5,
      "resumedCorrectness": 1,
      "retrievalRecall10": 1,
      "failedWrites": 0,
      "goalChars": 14841
    },
    {
      "policy": "unreferenced",
      "maxItems": 24,
      "footprint": {
        "bytes": 40289,
        "overhead": 2,
        "classes": {
          "counters": {
            "bytes": 44,
            "items": 2
          },
          "goals": {
            "bytes": 16443,
            "items": 1
          },
          "memories": {
            "bytes": 4899,
            "items": 6
          },
          "skills": {
            "bytes": 746,
            "items": 1
          },
          "archives": {
            "bytes": 18155,
            "items": 48
          }
        }
      },
      "evicted": [
        "round-0001",
        "round-0002",
        "round-0003",
        "round-0004",
        "round-0005",
        "round-0006",
        "round-0007",
        "round-0009",
        "round-0010",
        "round-0011",
        "round-0012",
        "round-0013",
        "round-0014",
        "round-0015",
        "round-0017",
        "round-0018",
        "round-0019",
        "round-0020",
        "round-0021",
        "round-0022",
        "round-0023",
        "round-0025",
        "round-0026",
        "round-0027"
      ],
      "addressResolution": 0.5,
      "referencedResolution": 1,
      "unreferencedResolution": 0.42857142857142855,
      "resumedCorrectness": 1,
      "retrievalRecall10": 1,
      "failedWrites": 0,
      "goalChars": 14841
    },
    {
      "policy": "checkpoint",
      "maxItems": 24,
      "footprint": {
        "bytes": 46238,
        "overhead": 2,
        "classes": {
          "counters": {
            "bytes": 44,
            "items": 2
          },
          "goals": {
            "bytes": 4227,
            "items": 1
          },
          "memories": {
            "bytes": 4899,
            "items": 6
          },
          "skills": {
            "bytes": 746,
            "items": 1
          },
          "archives": {
            "bytes": 36320,
            "items": 96
          }
        }
      },
      "evicted": [],
      "addressResolution": 1,
      "referencedResolution": 1,
      "unreferencedResolution": 1,
      "resumedCorrectness": 1,
      "retrievalRecall10": 1,
      "failedWrites": 1,
      "goalChars": 4216
    },
    {
      "policy": "none",
      "maxItems": 8,
      "footprint": {
        "bytes": 58454,
        "overhead": 2,
        "classes": {
          "counters": {
            "bytes": 44,
            "items": 2
          },
          "goals": {
            "bytes": 16443,
            "items": 1
          },
          "memories": {
            "bytes": 4899,
            "items": 6
          },
          "skills": {
            "bytes": 746,
            "items": 1
          },
          "archives": {
            "bytes": 36320,
            "items": 96
          }
        }
      },
      "evicted": [],
      "addressResolution": 1,
      "referencedResolution": 1,
      "unreferencedResolution": 1,
      "resumedCorrectness": 1,
      "retrievalRecall10": 1,
      "failedWrites": 1,
      "goalChars": 14841
    },
    {
      "policy": "oldest",
      "maxItems": 8,
      "footprint": {
        "bytes": 28185,
        "overhead": 2,
        "classes": {
          "counters": {
            "bytes": 44,
            "items": 2
          },
          "goals": {
            "bytes": 16443,
            "items": 1
          },
          "memories": {
            "bytes": 4899,
            "items": 6
          },
          "skills": {
            "bytes": 746,
            "items": 1
          },
          "archives": {
            "bytes": 6051,
            "items": 16
          }
        }
      },
      "evicted": [
        "round-0000",
        "round-0001",
        "round-0002",
        "round-0003",
        "round-0004",
        "round-0005",
        "round-0006",
        "round-0007",
        "round-0008",
        "round-0009",
        "round-0010",
        "round-0011",
        "round-0012",